id,name,popularity,explicit,duration_ms,album_name,album_release_date,artist_names,artist_ids,artist_genres,lyrics
3eRsSIhorhBnLrsy2uhM8r,Whatta Man,0,False,308360,Very Necessary,1993-10-12,"Salt-N-Pepa, En Vogue","7wqtxqI3eo7Gn1P7SpP6cQ, 5fikk4h5qbEebqK2Fc6e48",new jack swing,"53 ContributorsWhatta Man Lyrics
Yeah, yeah, hey, ooh, yeah
Uh, hey, hey, hey
Alright (Ooh, yeah)

What a man, what a man, what a man
What a mighty good man (You got to say it again now)
What a man, what a man, what a man
What a mighty good man (Yeah, he's a mighty, mighty good man)
What a man, what a man, what a man
What a mighty good man (Yes, he is)
What a man, what a man, what a man
What a mighty good man (Oh, uh, yeah)

I wanna take a minute or two, and give much respect due
To the man that's made a difference in my world
And although most men are hoes, he flows on the down low
'Cause I never heard about him with another girl
But I don't sweat it because it's just pathetic to let it
Get me involved in that he said, she said crowd
I know that ain't nobody perfect
I give props to those who deserve it, and believe me y'all, he's worth it
So here's to the future 'cause we got through the past
I finally found somebody that can make me laugh
Hahaha, you so crazy
I think I wanna have your baby (Ow)

What a man, what a man, what a man
What a mighty good man (Alright, yes, he is)
What a man, what a man, what a man
What a mighty good man (Oh, he's a  mighty, mighty good man)
What a man, what a man, what a man (Ooh-ooh)
What a mighty good man (Uh, you gotta say it again now)
What a man, what a man, what a man
What a mighty good man (Yeah, hey)

My man is smooth like Barry and his voice got bass
A body like Arnold with a Denzel face
He's smart like a doctor with a real good rep
And when he comes home, he's relaxed with Pep
He always got a gift for me every time I see him
A lot of snot-nosed ex-flames couldn't be him
He never ran a corny line once to me yet
So I give him stuff that he'll never forget
He keeps me on cloud nine just like the Temps
He's not a fake wannabe tryin' to be a pimp
He dresses like a dapper don, but even in jeans
He's a God-sent original, the man of my dreams

Yes, my man says he loves me, never says he loves me not
Mine'll rush me good and touch me in the right spot
See other guys that I've had, they tried to play all that mack ****
But every time they tried I said, ""That's not it""
But not this man, he's got the right potion
Baby, rub it down and make it smooth like lotion
Yeah, the ritual, highway to heaven
From seven to seven he's got me open like 7-Eleven
And yes, it's me that he's always choosin'
With him I'm never losin', and he knows that my name is not Susan
He always has heavy conversation for the mind
Which means a lot to me 'cause good men are hard to find

What a man, what a man, what a man
What a mighty good man (Uh, yeah, he's a  mighty, mighty good man)
What a man, what a man, what a man (Ooh, alright)
What a mighty good man (Say it again now)
What a man, what a man, what a man
What a mighty good man (Uh, ooh-ooh)
What a man, what a man, what a man
What a mighty good man (Oh, I said what a mighty good man)

You know what I'm sayin'? He's a mighty, mighty good man, y'all
Y'all don't hear me, now check him out

My man gives real loving, that's why I call him killer
He's not a wham-bam-thank-you-ma'am, he's a thriller
He takes his time and does everything right
Knocks me out with one shot for the rest of the night
He's a real smooth brother, never in a rush
And he gives me goose pimples with every single touch
Spends quality time with his kids when he can
Secure in his manhood 'cause he's a real man
A lover and a fighter and he'll knock a knucker out
Don't take him for a sucker, 'cause that's not what he's about
Every time I need him, he always got my back
Never disrespectful 'cause his mama taught him that (I've got a good man)

What a man, what a man, what a man
What a mighty good man (Uh, a mighty, mighty good man)
What a man, what a man, what a man (Yeah, talk to 'em)
What a mighty good man (Yes, he is, oh)
What a man, what a man, what a man
What a mighty good man (What a mighty good man)
What a man, what a man, what a man
What a mighty good man (He's a mighty, mighty good man, y'all)

Uh, what a mighty, mighty good man, y'all
Yeah, what a mighty good man
Yeah, hoo
Now break it down
A-break it down a-one time

Good God
Good God
What a man, what a man (Good God)
Good God
What a man, what a man (Good God)
Good God
What a man, what a man (Good God)
Good God
What a man, what a man (Good God)"
3Bzh1AtiViTIaZV6yqySZH,Miles Away,0,False,252866,In The Heart Of The Young,1990-07-20,Winger,2qQeKHrQJHLLbvDAOSO874,"glam metal, arena rock, album rock, hard rock, glam rock","9 ContributorsMiles Away Lyrics(Verse 1)
So this is love, or so you tell me
As you're walkin', out the door
Months go by, and I know for certain
It's not the love, I'm lookin' for
(Pre Chorus)
Some times, just for a moment
I reach out; hope you're still there
(Chorus)
Miles away
No; you're never turnin' back
I just can't wait anymore
Miles away
Nothin' left of what we had
Just when I needed you most...
You were miles away...
(Verse 2)
It's hard to tell, what you're goin' through
You kept your feelings locked inside of you
Open your heart, and chances are
What you're feelin', I'm feelin' too
(Pre Chorus)
If only, just for a moment
Hold on, to the dreams that we had

(Chorus)
Miles away
No; you're never turnin' back
I just can't wait anymore
Miles away
Nothin' left of what we had
Just when I needed you most
You were miles away
(Verse 3)
When times were tough, and you were down and out
Who was there by your side?
Now you've gone; I'm so tired of bein' alone..
With only your promises...
(Bridge)
Lonliness just fades away
Thoughts of you; just memories
No cryin' now, for what we're missin'
Time won't forget what you meant to me
Hold me, just for a moment
Hold on, to the dreams that we had
(Chorus)
Miles away
No; you're never turnin' back
I just can't wait anymore
Miles away
Nothin' left of what we had
Just when I needed you most, whoa-oh
Miles away
No; you're never turnin' back
I just can't wait anymore
Miles away
Nothin' left of what we had
Just when I needed you most...

(Outro)
You were mi-les a-way..."
2Pn5gvVioma5LHPxgEBBmD,"No More ""I Love You's""",64,False,291333,Medusa,1995,Annie Lennox,5MspMQqdVbdwP6ax3GXqum,synthpop,"18 ContributorsNo More “I Love You’s” Lyrics
I used to be a lunatic from the gracious days
I used to feel woebegone and so restless nights
My aching heart would bleed for you to see

Oh, but now
(I don't find myself bouncing home
Whistling buttonhole tunes to make me cry)

No more ""I love you's""
The language is leaving me
No more ""I love you's""
Changes are shifting outside the word
(The lover speaks about the monsters)

I used to have demons in my room at night
Desire, despair, desire
So many monsters

Oh, but now
(I don't find myself bouncing home
Whistling buttonhole tunes to make me cry)

No more ""I love you's""
The language is leaving me
No more ""I love you's""
The language is leaving me in silence

No more ""I love you's""
Changes are shifting outside the word

(And people are being real crazy
But we will only come
And you know what, mommy?
Everybody was being real crazy
The monsters are crazy
There are monsters outside)

No more ""I love you's""
The language is leaving me
No more ""I love you's""
The language is leaving me in silence

No more ""I love you's""
Changes are shifting outside the word
Outside the words

No more ""I love you's""
The language is leaving me
No more ""I love you's""
The language is leaving me

No more ""I love you's""
Changes are shifting outside the word
Outside the world"
1B7YpVYyp0nL5lIxTv2pig,Don't You (Forget About Me),0,False,263040,Once Upon A Time (Deluxe),1985-10-21,Simple Minds,6hN9F0iuULZYWXppob22Aj,new wave,"67 ContributorsDon’t You (Forget About Me) Lyrics
Hey, hey, hey, hey
Ooh, woah

Won't you come see about me?
I'll be alone, dancing, you know it, baby
Tell me your troubles and doubts
Giving me everything inside and out and
Love's strange, so real in the dark
Think of the tender things that we were working on
Slow change may pull us apart
When the light gets into your heart, baby

Don't you forget about me
Don't, don't, don't, don't
Don't you forget about me

Will you stand above me?
Look my way, never love me
Rain keeps falling, rain keeps falling
Down, down, down
Will you recognize me?
Call my name or walk on by
Rain keeps falling, rain keeps falling
Down, down, down, down

Hey, hey, hey, hey
Ooh, whoa

Don't you try and pretend
It's my feeling we'll win in the end
I won't harm you or touch your defenses
Vanity, insecurity, ah
Don't you forget about me
I'll be alone, dancing, you know it, baby
Goin' to take you apart
I'll put us back together at heart, baby

Don't you forget about me
Don't, don't, don't, don't
Don't you forget about me

As you walk on by
Will you call my name?
As you walk on by
Will you call my name?
When you walk away
Or will you walk away?
Will you walk on by?
Come on, call my name
Will you call my name?

I say, la, la-la-la-la, la-la-la-la
La-la-la-la-la-la-la-la-la-la
La-la-la-la, la-la-la-la
La-la-la-la-la-la-la-la-la-la
La-la-la-la, la-la-la-la
La-la-la-la-la-la-la-la-la-la
When you walk on by
And you call my name
When you walk on by"
4LByO7vWZlhQDqALVPjmCt,Greedy Fly,0,False,269546,Razorblade Suitcase (Remastered),1996-11-19,Bush,78SHxLdtysAXgywQ4vE0Oa,"grunge, post-grunge","10 ContributorsGreedy Fly Lyrics
Do you feel the way you hate?
Do you hate the way you feel?
Always closest to the flame
Ever closer to the blade
Yeah

I am poison crazy lush
Built these hands to lift me up
We are servants of our formulaic ways

I'm screaming daisies
From fourteen miles away
I've got my own time
Got it all today

Make up your mind
I need some help
To find this mind, mind, mind

Limbo this and limbo that
You were this and you were that
Ever know that what you fear is what you find

This indian summer
I signed my life away
There's a greedy fly in here
And I fly away

Make up your mind
I need some help
To find this mind, mind, mind
Make up your mind
I need some help
To find this mind, mind, mind
Mind, mind, mind, mind
Mind, mind, mind"
0UvCh63URrLFcPkKt99hHd,Don't Look Back in Anger - Remastered,74,False,289560,(What's The Story) Morning Glory? [Remastered],1995-10-02,Oasis,2DaxqgrOhkeH0fpeiQq2f4,"rock, madchester, britpop",
1yea9mxOFUgcXOt5cgiBT6,Only Happy When It Rains,0,False,236533,Garbage,1995,Garbage,6S0GHTqz5sxK5f9HtLXn9q,,"32 ContributorsOnly Happy When It Rains Lyrics
I'm only happy when it rains
I'm only happy when it's complicated
And though I know you can't appreciate it
I'm only happy when it rains
You know I love it when the news is bad
Oh why it feels so good to feel so sad
I'm only happy when it rains

Pour your misery down
Pour your misery down on me
Pour your misery down
Pour your misery down on me

I'm only happy when it rains
I feel good when things are goin' wrong
I only listen to the sad, sad songs
I'm only happy when it rains


I only smile in the dark
My only comfort is the night gone black
I didn't accidentally tell you that
I'm only happy when it rains
You'll get the message by the time I'm through
When I complain about me and you
I'm only happy when it rains

Pour your misery down (Pour your misery down)
Pour your misery down on me (Pour your misery down)
Pour your misery down (Pour your misery down)
Pour your misery down on me (Pour your misery down)
Pour your misery down (Pour your misery down)
Pour your misery down on me (Pour your misery down)
Pour your misery down (Pour)

You can keep me company
As long as you don't care

I'm only happy when it rains
You wanna hear about my new obsession?
I'm ridin' high upon a deep depression
I'm only happy when it rains

(Pour some misery down on me)
I'm only happy when it rains
(Pour some misery down on me)
I'm only happy when it rains
(Pour some misery down on me)
I'm only happy when it rains
(Pour some misery down on me)
I'm only happy when it rains
(Pour some misery down on me)
(Pour some misery down on me)
(Pour some misery down on me)
(Pour some misery down on me)
I'm only happy when it rains
(Pour some misery down on me)
(Pour some misery down on me)
(Pour some misery down on me)"
4zAbPhuOuVqAavP6xDQ0RN,Sleepwalker,0,False,211026,Breach,2000-01-01,The Wallflowers,0jJNGWrpjGIHUdTTJiIYeB,,"9 ContributorsSleepwalker LyricsMaybe I could be the one they adore
That could be my reputation
It's where I'm from that lets them think I'm a whore
I'm an educated virgin
Now sleepwalker don't be shy
Now don't open your eyes tonight
You'll be the one that defends my life
While I'm dead asleep dreaming
Cupid don't draw back your bow
Sam Cooke didn't know what I know
I'll never be your valentine
The sleepwalker in me
And God only know that I tried
Now Let me in, Let me drown or learn how to swim
Just don't leave me at the window
I could be the one to be your next best friend
You may need someone to hold you
Sleepwalker take this knife
You may see someone tonight
You'd be the one who saves my life
When I'm dead asleep dreaming
Cupid don't draw back your bow
Sam Cooke didn't know what I know
Never be your valentine
The sleepwalker in me
God only know that I tried

I'm in your movie and everyone looks sad
But I can hear your voice in the laughtrack
But you never saw my best scene
The one where I sleep
I sleepwalk into your dreams
Now sleepwalker what's my line?
Now it's only a matter of time
Until I learn to open up my eyes
When I'm dead asleep dreaming
Now Cupid don't draw back your bow
Sam Cooke didn't know what I know
Never be your valentine
The sleepwalker in me
Now the sleepwalker in me
Now the sleepwalker in me
And God only knows that I've tried"
4CPTAJth9JiuKYaMIemmDD,Back for Good - Radio Mix,0,False,242266,Nobody Else,1995,Take That,1XgFuvRd7r5g0h844A5ZUQ,,"1 ContributorBack for good - radio mix LyricsI guess now it's time for me to give up
I feel it's time
Got a picture of you beside me
Got your lipstick mark still on your coffee cup
Got a fist of pure emotion
Got a head of shattered dreams
Gotta leave it, gotta leave it all behind now
Whatever I said, whatever I did I didn't mean it
I just want you back for good
Whenever I'm wrong just tell me the song and I'll sing it
You'll be right and understood
Unaware but underlined I figured out this story
It wasn't good
But in the corner of my mind I celebrated glory
But that was not to be
In the twist of separation you excelled at being free
Can't you find a little room inside for me
Whatever I said, whatever I did I didn't mean it
I just want you back for good
Whenever I'm wrong just tell me the song and I'll sing it
You'll be right and understood
And we'll be together, this time is forever
We'll be fighting and forever we will be
So complete in our love
We will never be uncovered again
Whatever I said, whatever I did I didn't mean it
I just want you back for good
Whenever I'm wrong just tell me the song and I'll sing it
You'll be right and understood
I guess now it's time, that you came back for good"
6Qyc6fS4DsZjB2mRW9DsQs,Iris,92,False,289533,Dizzy up the Girl,1998,The Goo Goo Dolls,2sil8z5kiy4r76CRTXxBCA,,"103 ContributorsTranslationsDeutschÍslenskaPolskiIris Lyrics
And I'd give up forever to touch you
'Cause I know that you feel me somehow
You're the closest to heaven that I'll ever be
And I don't wanna go home right now

And all I could taste is this moment
And all I can breathe is your life
And sooner or later, it's over
I just don't wanna miss you tonight

And I don't want the world to see me
'Cause I don't think that they'd understand
When everything's made to be broken
I just want you to know who I am


And you can't fight the tears that ain't coming
Or the moment of truth in your lies
When everything feels like the movies
Yeah, you bleed just to know you're alive

And I don't want the world to see me
'Cause I don't think that they'd understand
When everything's made to be broken
I just want you to know who I am


And I don't want the world to see me
'Cause I don't think that they'd understand
When everything's made to be broken
I just want you to know who I am
And I don't want the world to see me
'Cause I don't think that they'd understand
When everything's made to be broken
I just want you to know who I am

I just want you to know who I am
I just want you to know who I am
I just want you to know who I am"
32Gf5A7Hr8RdgggXG0Fdks,"Have You Ever Really Loved A Woman? - From ""Don Juan DeMarco"" Soundtrack",74,False,291666,18 Til I Die,1996-06-04,Bryan Adams,3Z02hBLubJxuFJfhacLSDc,,"1 ContributorHave You Ever Really Loved A Woman? From Don Juan DeMarco” Soundtrack LyricsTo really love a woman
To understand her
You gotta know her deep inside
Hear every thought
See every dream
And give her wings when she wants to fly
Then when you find yourself layin' helpless in her arms
You know you really love a woman
When you love a woman
You tell her that she's really wanted
When you love a woman
You tell her that she's the one
She needs somebody
To tell her that it's gonna last forеver
So tell me havе you ever really
Really, really ever loved a woman?
To really love a woman
To let her hold you
'Til you know how she needs to be touched
You've gotta breathe her
Really taste her
'Til you can feel her in your blood
And when you can see your unborn children in her eyes
You know you really love a woman
When you love a woman
You tell her that she's really wanted

When you love a woman
You tell her that she's the one
♪
She needs somebody
To tell her that you'll always be together
So tell me have you ever really
Really, really ever loved a woman?
You got to give her some faith
Hold her tight
A little tenderness
You gotta treat her right
She will be there for you
Takin' good care of you
You really gotta love your woman
♪
Then when you find yourself layin' helpless in her arms
You know you really love a woman
When you love a woman
You tell her that she's really wanted
When you love a woman
You tell her that she's the one
She needs somebody
To tell her that it's gonna last forever
So tell me have you ever really
Really, really ever loved a woman?
Just tell me have you ever really
Really, really ever loved a woman?
Just tell me have you ever really
Really, really ever loved a woman?"
2dzlwyQY9ZQ07xZRGWwHO9,Ode To My Family,0,False,270706,No Need To Argue,1994-10-03,The Cranberries,7t0rwkOPGlDPEhaOcVtOt9,,"28 ContributorsOde to My Family Lyrics
Du-dudu-du-du-dudu-du
Du-dudu-du-du-dudu-du
Du-dudu-du-du-dudu-du
Du-dudu-du

Understand the things I say
Don't turn away from me
'Cause I've spent half my life out there
You wouldn't disagree

Do you see me, do you see?
Do you like me?
Do you like me standing there?
Do you notice, do you know?
Do you see me, do you see me?
Does anyone care?

Unhappiness where's when I was young
And we didn't give a damn
'Cause we were raised
To see life as fodder and take it if we can

My mother, my mother
She'd hold me
She'd hold me when I was out there
My father, my father
He liked me, well he liked me
Does anyone care?

Understand what I've become
It wasn't my design
And people everywhere think
Something better than I am

And I miss you, I miss
'Cause I liked it
'Cause I liked it
When I was out there
Do you know this, do you know?
You did not find me
You did not find
Does anyone care?

Unhappiness where's when I was young
And we didn't give a damn
'Cause we were raised
To see life as fodder and take it if we can

My mother, my mother
She'd hold me
She'd hold me when I was out there
My father, my father
He liked me, well he liked me
Does anyone care?

Does anyone care?
Does anyone care?
Does anyone care?
Does anyone care?
Does anyone care?
Does anyone care?
Does anyone care?
Does anyone care?
Does anyone care?

Du-dudu-du-du-dudu-du
Du-dudu-du-du-dudu-du
Du-dudu-du-du-dudu-du
Du-dudu-du"
4JiEyzf0Md7KEFFGWDDdCr,Knockin' On Heaven's Door,82,False,336000,Use Your Illusion II,1991-09-18,Guns N' Roses,3qm84nBOXUEQ2vnTfUTTFC,"classic rock, hard rock, rock, glam metal","56 ContributorsTranslationsPolskiKnockin’ on Heaven’s Door Lyrics
Ooh, ooh
Hey

Mama, take this badge from me
I can't use it anymore
It's gettin' dark, too dark to see
Feels like I'm knockin' on heaven's door

Knock-knock-knockin' on heaven's door, hey, hey, hey hey yeah
Knock-knock-knockin' on heaven's door, ooh
Knock-knock-knockin' on heaven's door, ooh-oh yeah
Knock-knock-knockin' on heaven's door, ayy hey yeah
Ooh-oh yeah, oh yeah, aw

Mama, put my guns in the ground (Ooh)
I can't shoot them anymore (Ooh)
That cold black cloud is comin' down (Ooh)
Feels like I'm knockin' on heaven's door (Ooh)

Knock-knock-knockin' on heaven's door, hey, hey, hey hey yeah
Knock-knock-knockin' on heaven's door
Knock-knock-knockin' on heaven's door, ooh yeah
Knock-knock-knockin' on heaven's door, ayy hey yeah
Ooh


You just better start sniffin' your own rank subjugation, Jack
Because it's just you against your tattered libido, the bank, and the mortician, forever, man
And it wouldn't be luck if you could get out of life alive

Knock-knock-knockin' on heaven's door, hey, hey, hey-hey yeah
Knock-knock-knockin' on heaven's door
Knock-knock-knockin' on heaven's door, ooh yeah
Knock-knock-knockin' on heaven's door
Knock-knock-knockin' on heaven's door, ooh, no, no, no, woah-oh
Knock-knock-knockin' on heaven's door
Knock-knock-knockin' on heaven's door, no, no, no, woah, no
Knock-knock-knockin' on heaven's door, woah-woah, woah-yeah
Knock-knock-knockin' on heaven's door
Knock-knock-knockin' on heaven's door, ooh yeah
Knock-knock-knockin' on heaven's door
Knock-knock-knockin' on heaven's door, woah, woah, woah
Woah, woah, yeah, oh"
72hpTHMLFrO4ErhSQl2FhZ,Can't Stop Lovin' You,64,False,247466,Balance,1995-01-24,Van Halen,2cnMpRsOVqtPMfq7YiFE6K,"rock, hard rock, glam metal, classic rock","11 ContributorsCan’t Stop Lovin’ You Lyrics
There's a time and place for everything, for everyone
We can push with all our might, but nothing's gonna come
Oh no, nothing's gonna change
And if I asked you not to try, oh, could you let it be?

I wanna hold you and say
We can't throw this all away
Tell me you won't go, you won't go
Do you have to hear me say

I can't stop lovin' you
And no matter what I say or do
You know my heart is true, oh
I can't stop lovin' you

You can change your friends, your place in life
You can change your mind
We can change the things we say
And do it anytime
Oh no, but I think you'll find
That when you look inside your heart
Oh, baby, I'll be there, yeah

Hold on
I'm holding on
Baby, just come on, come on, come on
I just wanna hear you say

I can't stop lovin' you
And no matter what you say or do
You know my heart is true, oh
I can't stop lovin' you

Oh, I'm so twisted and tied
And all I remember
Was how hard we tried
Only to surrender

And when it's over
I know how it's gonna be
And true love will never die
No, not fade away

And I can't stop lovin' you
And no matter what I say or do
You know my heart is true, oh
I can't stop lovin' you
And I know what I got to do
Hey Ray, what you said is true, oh
I can't stop lovin' you, oh
Oh, I can't stop lovin' you"
1HOMkjp0nHMaTnfAkslCQj,My Sharona,72,False,295400,Get The Knack,1979-01-01,The Knack,0Nn9YwJzcaeuU1jJL06e3r,power pop,"40 ContributorsMy Sharona Lyrics

Ooh, my little pretty one, pretty one
When you gonna give me some time, Sharona?
Ooh, you make my motor run, my motor run
Gun it coming off of the line, Sharona

Never gonna stop, give it up, such a dirty mind
I always get it up for the touch of the younger kind
My, my, my, I, yi, woo!
M-m-m-my Sharona

Come a little closer, huh, ah, will ya, huh?
Close enough to look in my eyes, Sharona
Keeping it a mystery gets to me
Running down the length of my thighs, Sharona

Never gonna stop, give it up, such a dirty mind
I always get it up for the touch of the younger kind
My, my, my, I, yi, woo!
M-m-m-my Sharona
M-m-m-my Sharona


When you gonna give to me, g-give to me?
Is it just a matter of time, Sharona?
Is it j-just destiny, d-destiny
Or is it just a game in my mind, Sharona?

Never gonna stop, give it up, such a dirty mind
I always get it up for the touch of the younger kind
My, my, my, I, yi, woo!
M-m-m-my my my, I, yi, woo!
M-m-m-my Sharona
M-m-m-my Sharona
M-m-m-my Sharona
M-m-m-my Sharona
Oooooh, my Sharona
Oooooh, my Sharona
Oooooh, my Sharona"
2bvzxeD1hPWEYotw40Euq9,Wishing Well,57,False,210466,Introducing The Hardline According To Sananda Maitreya,1987-07-06,Sananda Maitreya,6RGxLsQUoGk5PLyMVwb3yE,,"2 ContributorsWishing Well LyricsKissing like a bandit stealing time
Underneath the sycamore tree
Cupid by the hour sends valentines
To my sweet lover and me
Slowly but surely
Your appetite is more than I knew
Sweetly, softly
I'm falling in love with you
Wish me love a wishing well, to kiss and tell
A wishing well of butterfly tears
Wish me love a wishing well, to kiss and tell
A wishing well of crocodile cheers, sing
Hugging like a monkey see, monkey do
Right beside a riverboat gambler
Erotic images float through my head
Say I wanna be (I wanna be your midnight rambler) your midnight rambler
Quickly but quickly
The blood races through my veins
Quickly, loudly
I wanna hear those sugar bells ring
Wish me love a wishing well to kiss and tell
A wishing well of butterfly tears
Wish me love a wishing well to kiss and tell
A wishing well of crocodile cheers, get up

On the beat now
C'mon
Wish me love a wishing well to kiss and tell
A wishing well of butterfly tears, come on
Wish me love a wishing well to kiss and tell
A wishing well of crocodile cheers
I feel like going on
I feel like going on (Wish me love a wishing well to kiss and tell)
Come on, come on
Erotic images float through my head
Your midnight rambler, baby
Dig it
For you anywhere
I don't know I don't care
But all I know is I gotta
Gotta be your midnight rambler, baby"
