id,name,popularity,explicit,duration_ms,album_name,album_release_date,artist_names,artist_ids,artist_genres,lyrics
5VzvK7YiwWbRePA2JOzhYq,Because the Night - Live Unplugged,60,False,223373,MTV Unplugged (Live),1993-10-26,"10,000 Maniacs",0MBIKH9DjtBkv8O3nS6szj,jangle pop,"10 ContributorsBecause the Night (Live on MTV Unplugged) Lyrics
Take me now, baby, here as I am
Hold me close, and try and understand
Desire is hunger is the fire I breathe
Love is a banquet on which we feed

Come on now, try and understand
The way I feel under your command
Take my hand, as the sun descends
They can't hurt you now
Can't hurt you now
Can't hurt you now

Because the night belongs to lovers
Because the night belongs to us
Because the night belongs to lovers
Because the night belongs to us

Have I doubt, baby, when I'm alone
Love is a ring, a telephone
Love is an angel disguised as lust
Here in our bed 'til the morning comes

Come on now, try and understand
The way I feel under your command
Take my hand, as the sun descends
They can't hurt you now
Can't hurt you now
Can't hurt you now

Because the night belongs to lovers
Because the night belongs to us
Because the night belongs to lovers
Because the night belongs to us

With love we sleep, with doubt the vicious cycle turns, and burns
Without you oh I cannot live, forgive the yearning Burning
I believe it's time, too real to feel
So take me now, take me now, take me now

Because the night belongs to lovers
Because the night belongs to us
Because the night belongs to lovers
And everybody says that it belongs to us"
5qqabIl2vWzo9ApSC317sa,Wonderwall - Remastered,79,False,258773,(What's The Story) Morning Glory? [Remastered],1995-10-02,Oasis,2DaxqgrOhkeH0fpeiQq2f4,"rock, madchester, britpop",
7f0jXNMu2xjQUtmKMuWhGA,What's Up?,3,False,295493,"Bigger, Better, Faster, More !",1992-01-01,4 Non Blondes,0Je74SitssvJg1w4Ra2EK7,,"96 ContributorsTranslationsDeutschWhat’s Up? Lyrics
25 years and my life is still
Tryin' to get up that great big hill of hope
For a destination
I realized quickly when I knew I should
That the world was made up of this brotherhood of man
For whatever that means

And so I cry sometimes when I'm lying in bed
Just to get it all out what's in my head
And I, I am feeling a little peculiar
And so I wake in the morning and I step outside
And I take a deep breath and I get real high
And I scream from the top of my lungs
""What's going on?""

And I say, hey-ey-ey
Hey-ey-ey
I said ""Hey, a-what's going on?""
And I say, hey-ey-ey
Hey-ey-ey
I said ""Hey, a-what's going on?""

Ooh, ooh
Ooh
Ooh, uh huh
Ooh, ooh
Ooh
Ooh, uh huh

And I try
Oh my God, do I try
I try all the time
In this institution
And I pray
Oh my God, do I pray
I pray every single day
For revolution

And so I cry sometimes when I'm lying in bed
Just to get it all out, what's in my head
And I, I am feeling a little peculiar
And so I wake in the morning and I step outside
And I take a deep breath and I get real high
And I scream from the top of my lungs
""What's going on?""

And I say, hey-ey-ey
Hey-ey-ey
I said ""Hey, what's going on?""
And I say, hey-ey-ey
Hey-ey-ey
I said ""Hey, a-what's going on?""
And I say, hey-ey-ey
(Wake in the morning and step outside)
Hey-ey-ey
(Take a deep breath and I get real high)
(And I scream)
I said ""Hey, a-what's going on?""
And I say, hey-ey-ey
(Wake in the morning and step outside)
Hey-ey, yeah yeah yeah
(Take a deep breath and I get real high)
(And I scream)
I said ""Hey, a-what's going on?""

Ooh, ooh
Ooh
Ooh, uh huh

25 years and my life is still
Tryin' to get up that great big hill of hope
For a destination, mmm"
1eRqy8jW4ZLMJR6dl3xsgI,Lovefool - Radio Edit,0,False,193893,First Band On The Moon,1996-09-17,The Cardigans,1tqZaCwM57UFKjWoYwMLrw,,"2 ContributorsLovefool (Radio Edit) Lyrics
Love me, love me
Fool me, fool me
Love me, love me
Fool me, fool me
Love me, love me
Say that you love me
Fool me, fool me
Go on and fool me
Love me, love me
Say that you love me
Fool me, fool me
Go on and fool me

Dear, I fear we're facing a problem
You love me no longer, I know
And maybe there is nothing
That I can do to make you do
Mama tells me I shouldn't bother
That I ought to stick to another man
A man that surely deserves me
But I think you do!
Just say...

Love me, love me
Say that you love me
Fool me, fool me
Go on and fool me
Love me, love me
Say that you love me
Fool me, fool me
Go on and fool me
Love me, love me
Fool me, fool me
Love me, love me
Fool me, fool me
Go on and fool me

Lately I have desperately pondered
Spent my nights awake and I wonder
What I could have done in another way
To make you stay
Reason will not lead to solution
I will end up lost in confusion
I don't care if you really care
As long as you don't go
Just say...

Love me, love me
Say that you love me
Fool me, fool me
Go on and fool me
Love me, love me
Say that you love me
Fool me, fool me
Go on and fool me

I cry and I pray
I cry and I pray
And I beg
And I beg
I cry and I pray
I cry and I pray
And I beg
And I beg
I cry and I pray
I cry and I pray
And I beg
And I beg

Love me, love me
Fool me, fool me
Love me, love me
Fool me, fool me
Love me, love me
Fool me, fool me

Love me, love me (Say that you love me)
Fool me, fool me (Go on and fool me)
Love me, love me
Fool me, fool me"
5DiXcVovI0FcY2s0icWWUu,Mr. Jones,82,False,272293,August And Everything After,1993-01-01,Counting Crows,0vEsuISMWAKNctLlUAhSZC,,"87 ContributorsMr. Jones Lyrics
Sha-la-la-la, la-la-la
Mm, uh-huh

I was down at the New Amsterdam
Staring at this yellow-haired girl
Mr. Jones strikes up a conversation
With a black-haired flamenco dancer
You know, she dances while his father plays guitar
She's suddenly beautiful
And we all want something beautiful
Man, I wish I was beautiful

So come dance this silence down through the morning
Sha-la-la-la-la, la-la-la-la, yeah
Uh-huh, yeah
Cut up, Maria
Show me some of them Spanish dances and
Pass me a bottle, Mr. Jones
Believe in me
Help me believe in anything
'Cause I wanna be someone who believes
Yeah

Mr. Jones and me
Tell each other fairy tales
And we stare at them beautiful women
She's looking at you
Oh no, no, she's looking at me
Smiling in the bright lights
Coming through in stereo
When everybody loves you
You can never be lonely

Well, I'm gon' paint my picture
Paint myself in blue and red, and black, and gray
All of the beautiful colors are very, very meaningful
Yeah, well, you know gray is my favorite color
I felt so symbolic yesterday
If I knew Picasso
I would buy myself a gray guitar and play

Mr. Jones and me
Look into the future
Yeah, we stare at the beautiful women
She's looking at you
I don't think so, she's looking at me
Standing in the spotlight
I bought myself a gray guitar
When everybody loves me
I will never be lonely

I will never be lonely
Said, I'm never gonna be lonely

I wanna be a lion
Yeah, everybody wanna pass as cats
We all wanna be big, big stars
Yeah, but we got different reasons for that
Believe in me
'Cause I don't believe in anything
And I, I wanna be someone to believe
To believe, to believe, yeah

Mr. Jones and me
Stumbling through the barrio
Yeah, we stare at the beautiful women
She's perfect for you
Man, there's got to be somebody for me
I wanna be Bob Dylan
Mr. Jones wishes he was someone
Just a little more funky
When everybody loves you
Oh son, that's just about as funky as you can be
Mr. Jones and me
Staring at the video
When I look at the television, I wanna see me
Staring right back at me
We all wanna be big stars
But we don't know why and we don't know how
But when everybody loves me
I wanna be just about as happy as I can be

Mr. Jones and me
We're gonna be big stars"
1iUvSmGGQrhCltmenwKTFZ,Pain Lies On The Riverside,0,False,311666,Mental Jewelry,1991-01-01,Live,6eoJpTIlcuxJNjV5fDzDJH,"grunge, post-grunge","5 ContributorsPain Lies On The Riverside Lyrics(I, I)
I have never taken life
Yet I have often paid the price
And you, you are a victim of this age
And the guilt that hangs around your neck
Has got me locked up in a cage
You've got to learn to live until no end
But first you must learn to swim
All over again
Oh no because...
Pain lies on the riverside (yes)
And pain will never say goodbye (no no)
Pain lies on the riverside
So put your feet in the water
Put your head in the water
Put your soul in the water
Join me for a swim tonight
I have forever, always tried
To stay clean and constantly baptized (oh)
I'm aware that the river's banks they are dry
And to wait for a flood
Is to wait for life

I've got to learn to live until no end
But first I must learn to swim all over again
Yeah yeah yeah because...
Pain lies on the riverside (yeah)
And pain will never say goodbye (no no)
Pain lies on the riverside
So put your feet in the water
Put your head in the water
C'mon put your soul in the water
Join me for a swim tonight
For a swim tonight
(Oh my Lord)
I've got to learn to live until no end
I've got to learn to swim
All over, all over, all over again
Yeah yeah yeah because
Pain lies on the riverside
(oooh nah nah nah nah)
And pain will never say goodbye (no no)
Pain lies on the riverside
So put your feet in the water
Put your head in the water now
C'mon put your soul in the water
Join me for a swim tonight

For a swim tonight
To swim (all over, all over, all over, all over again)
To live (all over, all over, all over, all over again)
Live (all over again)"
3ablgRauQTQcoduS3L6XYw,Suicide Blonde,0,False,232009,X (Remastered),1990-09-25,INXS,1eClJfHLoDI4rZe5HxzBFv,,"16 ContributorsSuicide Blonde Lyrics
Don't you know what you're doing? (Oh)
You've got a death wish
Yeah?
Suicide blonde, suicide blonde
Suicide blonde, suicide blonde

Suicide blonde was the colour of her hair
Like a cheap distraction
For a new affair
She knew it would finish
Before it began
Woah, baby, you lost the plan

You wanna make her suicide blonde
Love devastation, suicide blonde
You wanna make her suicide blonde
Love devastation, suicide blonde

She stripped to the beat
But her clothes stay on
White light everywhere
But you can't see a thing
Such a squeeze, a mad, sad moment
Glory to you, glory to you, take me there
Ooh, take me there (Ow)

You got some revelation put into your hands
Save you from your misery
Like rain across the land
Don't you see the colour of deception?
Turning your world around again

You wanna make her suicide blonde
Love devastation, suicide blonde
You wanna make her suicide blonde
Love devastation, suicide blonde, say it

(You wanna make—)
(You wanna make—)
You wanna make her suicide blonde
You wanna make— (Hahaha)
Ow

That's the story
Everything you wanna be
Everything you are, are
Mm-mm, yeah


You wanna make her suicide blonde
Love devastation, suicide blonde (Oh)
You wanna make her suicide blonde
Love devastation, suicide blonde, yeah

Love devastation
You wanna make her suicide blonde
Love devastation, suicide blonde
You wanna make her suicide blonde"
6GKJUyIC50rzo8JKFkCfdA,Linger,0,False,274706,"Everybody Else Is Doing It, So Why Can't We?",1993-03-01,The Cranberries,7t0rwkOPGlDPEhaOcVtOt9,,"74 ContributorsTranslationsEspañolLinger Lyrics
If you, if you could return
Don't let it burn, don't let it fade
I'm sure I'm not being rude
But it's just your attitude
It's tearing me apart
It's ruining everything
And I swore, I swore I would be true
And honey, so did you
So why were you holding her hand?
Is that the way we stand?
Were you lying all the time?
Was it just a game to you?

But I'm in so deep
You know I'm such a fool for you
You've got me wrapped around your finger
Do you have to let it linger?
Do you have to, do you have to, do you have to let it linger?

Oh, I thought the world of you
I thought nothing could go wrong
But I was wrong, I was wrong
If you, if you could get by
Trying not to lie
Things wouldn't be so confused
And I wouldn't feel so used
But you always really knew
I just want to be with you

And I'm in so deep
You know I'm such a fool for you
You've got me wrapped around your finger
Do you have to let it linger?
Do you have to, do you have to, do you have to let it linger?


And I'm in so deep
You know I'm such a fool for you
You've got me wrapped around your finger
Do you have to let it linger?
Do you have to, do you have to, do you have to let it linger?
You know I'm such a fool for you
You've got me wrapped around your finger
Do you have to let it linger?
Do you have to, do you have to, do you have to let it linger?"
3Y8Ff1nH44jFywAtpgmleZ,1979 - Remastered 2012,61,False,266200,Mellon Collie And The Infinite Sadness (Remastered),1995-12-12,The Smashing Pumpkins,40Yq4vzPs9VNUrIBG5Jr2i,"rock, alternative rock",
31v2AQlx4pDI7kmnLxBkem,Mmm Mmm Mmm Mmm,67,False,235173,God Shuffled His Feet,1993-04-05,Crash Test Dummies,1YEGETLT2p8k97LIo3deHL,,"50 ContributorsTranslationsDeutschMmm Mmm Mmm Mmm Lyrics
Once there was this kid who
Got into an accident and couldn't come to school
But when he finally came back
His hair had turned from black into bright white
He said that it was from when
The cars had smashed so hard

Mmm, mmm, mmm, mmm
Mmm, mmm, mmm, mmm

Once there was this girl who
Wouldn't go and change with the girls in the change room
But when they finally made her
They saw hurt marks all over her body
She couldn't quite explain it
They'd always just been there

Mmm, mmm, mmm, mmm
Mmm, mmm, mmm, mmm
Mmm, mmm, mmm, mmm
Mmm, mmm, mmm, mmm

But both girl and boy were glad
'Cause one kid had it worse than that

'Cause then there was this boy whose
Parents made him come directly home right after school
And when they went to their church
They shook and lurched all over the church floor
He couldn't quite explain it
They'd always just gone there

Mmm, mmm, mmm, mmm
Mmm, mmm, mmm, mmm
Mmm, mmm, mmm, mmm
Mmm, mmm, mmm, mmm"
5oSCqtN7I9XjeMrnmN0fWW,"Tom's Diner - 7"" Version",0,False,228533,RetroSpective: The Best Of Suzanne Vega,2003-01-01,"DNA, Suzanne Vega","2rGm8R7YDTbqDCVlNssQyL, 3X0tJzVYoWlfjLYI0Ridsw",singer-songwriter,
2hYeD63jpntJDXklv4ETE5,If It Makes You Happy,0,False,324840,Sheryl Crow,1996-09-24,Sheryl Crow,4TKTii6gnOnUXQHyuo9JaD,,"37 ContributorsIf It Makes You Happy Lyrics
I've been a long
A long way from here
Put on a poncho, played for mosquitoes
And drank 'til I was thirsty again
We went searchin'
Through thrift store jungles
Found Geronimo's rifle, Marilyn's shampoo
And Benny Goodman's corset and pen

Well, okay, I made this up
I promised you I'd never give up

If it makes you happy
It can't be that bad
If it makes you happy
Then why the hell are you so sad?

You get down
Real low down
You listen to Coltrane, derail your own train
Well, who hasn't been there before?
I come 'round
Around the hard way
Bring you comics in bed, scrape the mold off the bread
And serve you French toast again

Well, okay, I still get stoned
I'm not the kind of girl you'd take home

If it makes you happy
It can't be that bad
If it makes you happy
Then why the hell are you so sad?
If it makes you happy
It can't be that bad
If it makes you happy
Then why the hell are you so sad?

We've been far
Far away from here
Put on a poncho, played for mosquitoes
And everywhere in-between

Well, okay, we get along
So what if right now everything's wrong?

If it makes you happy
It can't be that bad
If it makes you happy
Then why the hell are you so sad?
If it makes you happy
It can't be that bad
If it makes you happy
Then why the hell are you so sad?

Oh, oh-oh"
11VGhd5i7deLL0YB0ayicY,Yesterdays,64,False,196226,Use Your Illusion II,1991-09-18,Guns N' Roses,3qm84nBOXUEQ2vnTfUTTFC,"classic rock, hard rock, rock, glam metal","19 ContributorsYesterdays Lyrics
Yesterday, there was so many things I was never told
Now that I'm starting to learn, I feel I'm growing old
'Cause yesterday's got nothing for me
Old pictures that I'll always see
Time just fades the pages in my book of memories
Prayers in my pocket, and no hand in destiny
I'll keep on movin' along with no time to plant my feet
'Cause yesterday's got nothing for me
Old pictures that I'll always see
Some things could be better if we'd all just let them be

Ooh, yesterday's got nothing for me
Yesterday's got nothing for me
Got nothing for me, ooh, yeah


Yesterday, there were so many things I was never shown
Suddenly, this time I found I'm on the streets and I'm all alone
Yesterday's got nothing for me
Old pictures that I'll always see
I ain't got time to reminisce old novelties

Ooh, yesterday's got nothing for me
Yesterday's, ooh, got nothing for me
Yesterday's got nothing for me
Yesterday

Yesterday"
2DjWsDGgL1xNbhnr7f6t5F,Baby Can I Hold You,77,False,193120,Tracy Chapman,1988-04-05,Tracy Chapman,7oPgCQqMMXEXrNau5vxYZP,,"27 ContributorsTranslationsDeutschBaby Can I Hold You Lyrics
Sorry
Is all that you can't say
Years gone by and still
Words don't come easily
Like sorry, like sorry

Forgive me
Is all that you can't say
Years gone by and still
Words don't come easily
Like forgive me, forgive me

But you can say baby
Baby can I hold you tonight
Maybe if I told you the right words
At the right time
You'd be mine

I love you
Is all that you can't say
Years gone by and still
Words don't come easily
Like I love you, I love you

But you can say baby
Baby can I hold you tonight
Maybe if I told you the right words
At the right time, you'd be mine

Baby can I hold you tonight
Maybe if I told you the right words
At the right time, you'd be mine
You'd be mine
You'd be mine"
3i6qNxyVgIdUZTTi5m25EM,Bitch,72,False,252760,Blurring The Edges,1997-01-01,Meredith Brooks,2QmLFuIDtNDmmJY3OtvinN,,"32 ContributorsBitch Lyrics
I hate the world today
You're so good to me, I know, but I can't change
Tried to tell you but you look at me like maybe
I'm an angel underneath
Innocent and sweet

Yesterday I cried
You must have been relieved to see the softer side
I can understand how you'd be so confused
I don't envy you
I'm a little bit of everything all rolled into one

I'm a bitch, I'm a lover
I'm a child, I'm a mother
I'm a sinner, I'm a saint
I do not feel ashamed
I'm your Hell, I'm your dream
I'm nothing in between
You know you wouldn't want it any other way

So take me as I am
This may mean you'll have to be a stronger man
Rest assured that when I start to make you nervous
And I'm going to extremes
Tomorrow I will change and today won't mean a thing

I'm a bitch, I'm a lover
I'm a child, I'm a mother
I'm a sinner, I'm a saint
I do not feel ashamed
I'm your Hell, I'm your dream
I'm nothing in between
You know you wouldn't want it any other way

Just when you think you got me figured out
The season's already changing
I think it's cool, you do what you do
And don't try to save me

I'm a bitch, I'm a lover
I'm a child, I'm a mother
I'm a sinner, I'm a saint
I do not feel ashamed
I'm your Hell, I'm your dream
I'm nothing in between
You know you wouldn't want it any other way

I'm a bitch, I'm a tease
I'm a goddess on my knees
When you hurt, when you suffer
I'm your angel undercover
I've been numb, I'm revived
Can't say I'm not alive
You know I wouldn't want it any other way"
21MLFi0ISlqDBp7DQHPi7p,Would I Lie To You?,0,False,279600,Duophonic,1992-01-01,Charles & Eddie,5rIhaCHkbFVvLJpKHWwOJD,,"21 ContributorsTranslationsDeutschWould I Lie To You? Lyrics
No, no, no, baby
Mhm-mmm
La-la-la-la-la-la (Look into my eyes)
Would I lie to you, yeah? (Would I lie to you, baby, would I lie to you?)

Look into my eyes, can't you see they're open wide?
Would I lie to you, baby, would I lie to you? (Oh, yeah)
Don't you know it's true, girl, there's no one else but you?
Would I lie to you, baby, yeah? Come on

Everybody wants to know the truth
In my arms is the only proof
I've hidden my heart behind the bedroom door
Now it's open, I can't do no more

I'm telling you, baby, you will never find another girl
In this heart of mine (Oh-oh, oh)

Look into my eyes, can't you see they're open wide?
Would I lie to you, baby, would I lie to you? (Oh, yeah)
Don't you know it's true, girl, there's no one else but you?
Would I lie to you, baby, yeah? Come on (Would I lie to you?)

Everybody's got their history (History)
On every page, a mystery (It's a mystery, yeah)
You can read my diary, you're in every line
Jealous minds, never satisfied

I'm telling you, baby, you will never find another girl
In this heart of mine, woo! (In this heart of mine)

Look into my eyes, can't you see they're open wide?
Would I lie to you, baby, would I lie to you? (Oh, yeah)
Don't you know it's true, girl, there's no one else but you?
Would I lie to you, baby, yeah? (Would I lie to you?)
Come on

(Ooh, look into my eyes) Ooh, ooh
(Would I lie to you, baby? Would I lie to you?) Would I lie to you, baby? (Oh, yeah)
(Ooh, look into my eyes) Yeah, yeah
(Would I lie to you, baby? Would I lie to you?) Oh, oh, oh, oh

(Would I lie to you?) When you wanna see me night and day
(Would I lie?) If I tell you that I'm here to stay
(Would I lie to you?) Do you think I give my love away?
(Would I lie?) That's not the kind of game I play

I'm telling you, baby, you will never find another girl
In this heart of mine (In this heart of mine, deep in my heart)
Woo

Look into my eyes, can't you see they're open wide?
Would I lie to you, baby, would I lie to you? (Oh, yeah)
Don't you know it's true, girl, there's no one else but you?
Would I lie to you, baby, yeah? (Would I lie to you?)
(Would I lie to you, baby?) Come on
Look into my eyes, can't you see they're open wide?
Would I lie to you, baby, would I lie to you? (Oh, yeah)
Don't you know it's true, girl, there's no one else but you?
Would I lie to you, baby, yeah? (Would I lie to you?)
(Come on, come on, come on, come on and kiss me, baby)
(Ooh, look into my eyes) Hey, woohoo
(Would I lie to you, baby, would I lie to you?)
There ain't no one else but you
(Ooh, look into my eyes) Oh, oh
(Would I lie to you, baby, would I lie to you?)
Come on, come on, come on, come on and trust me, baby
(Ooh, look into my eyes)
I won't lie to you, baby (Would I lie to you?) (Oh, yeah)
There ain't no-one else but you, darling
Tell me what you need, I got what you need, yeah"
70i9JBvJXjJqhUw8aWLhmu,Back To Life (However Do You Want Me),23,False,230560,Volume IV - The Classic Singles 88-93,1993-01-01,"Soul II Soul, Caron Wheeler","2sIx6SmAMw9IBySG3Uj0jf, 2RhMHmV21ZDcSGZ872U4ZY",new jack swing,"37 ContributorsBack to Life (However Do You Want Me) Lyrics
Back to life, back to reality
Back to life, back to reality

Back to life, back to reality
Back to the here and now, oh yeah
Show me how, decide what you want from me
Tell me maybe I could be there for you

However do you want me
However do you need me, how
However do you want me
However do you need me
However do you want me
However do you need me, how
However do you want me
However do you need me

Back to life, back to the present time
Back from a fantasy, yes
Tell me now, take the initiative
I'll leave it in your hands until you're ready

However do you want me
However do you need me, how
However do you want me (Hold me now, do you want me?)
However do you need me
However do you want me (However)
However do you need me, how
However do you want me
However do you need me

However do you need me
However do you need me
However do you need me
However do you need me

I live at the top of the block
No more room for trouble and fuss (No more room, no, no, no there's not)
Need a change (Oh), a positive change
Look, it's my writing on the wall (Oh, oh, however do you want me, oh)

However do you want me
However do you need me, how
However do you want me, how, how
However do you need me
However do you want me
However do you need me, how
However do you want me (Oh)
However do you need me (Tell me now, how do you want me to be?)


Back to life, back to the day we had
Let's end this foolish game
Hear me out, don't let it waste away
Make up your mind so I know where I stand

However do you want me
However do you need me, how
However do you want me
However do you need me
However do you want me
However do you need me, how
However do you want me
However do you need me

However do you want me
However do you need me, how
However do you want me
However do you need me
However do you want me
However do you need me, how
However do you want me
However do you need me"
2UY4BdOZ7Ncfke96BBUTzM,Erase / Rewind,0,False,215760,Gran Turismo,1998-10-01,The Cardigans,1tqZaCwM57UFKjWoYwMLrw,,"14 ContributorsErase/Rewind Lyrics
Hmm-hmm
Hmm-hmm-hmm

Hey, what did you hear me say
You know the difference it makes
What did you hear me say
Yes, I said it's fine before
But I don't think so no more
I said it's fine before

I've changed my mind
I take it back

Erase and rewind
Cause I'll be changing my mind
Erase and rewind
Cause I'll be changing my mind
I've changed my mind

So where did you see me go?
It's not the right way, you know
Where did you see me go?
No, it's not that I don't know
I just don't want it to grow
It's not that I don't know

I've changed my mind
I take it back

Erase and rewind
Cause I'll be changing my mind
Erase and rewind
Cause I'll be changing my mind
Erase and rewind
Cause I'll be changing my mind
Erase and rewind
Cause I'll be changing my mind

Erase and rewind, hmm-hmm
Erase and rewind, hmm-hmm
I've changed my mind"
75gfxIedwH7j2s5nc7JgWh,Silent Lucidity - Remastered 2003,36,False,347760,Empire (Expanded Edition / Remastered/2003),1990,Queensrÿche,2OgUPVlWYgGBGMefZgGvCO,"glam metal, metal, progressive metal, progressive rock, heavy metal, hard rock",
0qeKzbUsW0V4ZWRJrHNiD3,Bad Boys (Theme from COPS),4,False,229374,Blazzin' Fire,2010-12-14,Inner Circle,5os0Ltvz8Q8BvXOPOd1frx,reggae,
